Event Title,Date,Heure,Venue Name,Price,Event Link,Location,Artists,Genres,Organizer
Sagra on the River,2024-01-19,19:00,Péniche Marcounet,"11,33 €",https://dice.fm/event/g3gb6-sagra-on-the-river-19th-jan-pniche-marcounet-paris-tickets,"Port de l'Hotel de Ville, Paris 75004",,,
Blu·e Velvet #27,2024-01-19,20:00,Ground Control Gare de Lyon,10 €,https://dice.fm/event/qpolp-blue-velvet-27-19th-jan-ground-control-gare-de-lyon-paris-tickets,"81 Rue du Charolais, 75012 Paris, France",,,
HandsDown Party avec Neg'Marrons à Food Society,2024-01-19,22:00,Le Food Society Paris,"À partir de 12,24 €",https://dice.fm/event/68ex7-handsdown-party-avec-negmarrons-food-society-19th-jan-le-food-society-paris-paris-tickets,"68 Avenue Du Maine, 75014 Paris, France",Fin de soirée,,
HandsDown Party avec Neg'Marrons à Food Society,2024-01-19,22:00,Le Food Society Paris,"À partir de 12,24 €",https://dice.fm/event/68ex7-handsdown-party-avec-negmarrons-food-society-19th-jan-le-food-society-paris-paris-tickets,"68 Avenue Du Maine, 75014 Paris, France",Fin de soirée,,
Studio 2054 : Session #7 - Petit Bain,2024-01-19,23:45 à 05:30,Petit Bain,"12,99 €",https://shotgun.live/events/studio-2054-session-7-petit-bain,"7 Port de la Gare, 75013 Paris, France",1NSONGE,"pop, house, trance, techno, eurodance",Studio 2054
Djoon: Groove Boys Project (all night long),2024-01-19,23:59 à 06:00,Djoon,"10,99 €",https://shotgun.live/events/djoon-groove-boys-project-all-night-loong,"22 Bd Vincent Auriol, 75013 Paris, France","Groove Boys Project, Lucas Moinet, Boyzi","garage, house, deep house, chicago house, disco",DJOON
Pygments Lab #14,2024-01-19,18:00 à 02:00,Fluctuart - Centre d'art urbain,Gratuit,https://shotgun.live/events/pygments-lab-14,"2 port du Gros Caillou, 75007 Paris, France","Victtoria, Palomina, C•LYYA, Paradigg', CATTONI, Kojo Kara","house, acid house, tech house, trance, micro house",Pygments Records
Vendredi teuf au Pmu : Dj set et Piliers de bar ( N°7 ),2024-01-19,18:30 à 02:00,Non mentionné,Gratuit,https://shotgun.live/events/vendredi-teuf-au-pmu-dj-set-et-piliers-de-bar-n-7,Lieu secret,Clément Wyse,,BLDG
Back It Up !,2024-01-19,20:00,911 Paris,À partir de Gratuit,https://dice.fm/event/v2ga7-back-it-up-19th-jan-911-paris-paris-tickets,"18 Rue Paul Klee, 75013 Paris, France",,,
La Pépinière • D'amour et d'eau fraîche,2024-01-19,19:30,Le Mazette,"À partir de 9,18 €",https://dice.fm/event/25mdp-la-ppinire-damour-et-deau-frache-19th-jan-le-mazette-paris-tickets,"69 Port de la Rapée, 75012 Paris, France",,,
La Pépinière • D'amour et d'eau fraîche,2024-01-19,19:30,Le Mazette,"À partir de 9,18 €",https://dice.fm/event/25mdp-la-ppinire-damour-et-deau-frache-19th-jan-le-mazette-paris-tickets,"69 Port de la Rapée, 75012 Paris, France",,,
Echo N°01 avec FLOORFILLERS et MARBRÉ,2024-01-19,22:00 à 05:00,Guru Club,"6,99 €",https://shotgun.live/events/echo-n-01,"36 Bd de la Bastille, 75012 Paris, France","Floorfillers, Marbré, LOЯIS, Yanmez","house, acid house, garage, disco house",Echo
Back It Up !,2024-01-19,20:00,911 Paris,À partir de Gratuit,https://dice.fm/event/v2ga7-back-it-up-19th-jan-911-paris-paris-tickets,"18 Rue Paul Klee, 75013 Paris, France",,,
Blu·e Velvet #27,2024-01-19,20:00,Ground Control Gare de Lyon,10 €,https://dice.fm/event/qpolp-blue-velvet-27-19th-jan-ground-control-gare-de-lyon-paris-tickets,"81 Rue du Charolais, 75012 Paris, France",,,
Kapital x Mute 19/01,2024-01-19,23:00 à 07:00,Non mentionné,"14,99 €",https://shotgun.live/events/kapital-x-mute-19-01,Lieu secret,"4000 Hz, Jaag, LO:ST, NØX  MUSICC, ERRØR666","techno, acid techno, hard techno, industrial techno",Kapital
HandsDown Party avec Neg'Marrons à Food Society,2024-01-19,22:00,Le Food Society Paris,"À partir de 12,24 €",https://dice.fm/event/68ex7-handsdown-party-avec-negmarrons-food-society-19th-jan-le-food-society-paris-paris-tickets,"68 Avenue Du Maine, 75014 Paris, France",Fin de soirée,,
"Disorder:Sterling Moss, Ey.Rah, Obese, I.N.D &more",2024-01-19,20:00 à 06:00,River's King,"15,99 €",https://shotgun.live/events/disorder-sterling-moss-ey-rah-obese-i-n-d-more,"4 Quai Saint-Bernard, 75005 Paris, France","Sterling Moss, ey.rah, G High DJo, Sony Cannonbar, KIFOOF'N (killa disco), FLÖ OrNOrm, Obese, NAⱯRCOSE, Ronin","acid techno, techno, hard techno, breakbeat, jungle",BEAT ADDICTS
Sam Ruffilo (Toy tonics)+Marc Brauner(Houseum)+Disco Bagarre,2024-01-19,23:30 à 07:00,La Java,"10,69 €",https://shotgun.live/events/sam-ruffilo-toy-tonics-marc-brauner-houseum-disco-bagarre,"105 Rue du Faubourg du Temple, 75010 Paris, France","Sam Ruffillo, Toy Tonics, Marc Brauner, Houseum, Disco Bagarre","house, disco, electro",LA JAVA
La Dédale,2024-01-19,23:00 à 08:00,La Péniche Cinéma - Le Baruda,"9,99 €",https://shotgun.live/events/la-dedale,"59 Bd Macdonald, 75019 Paris, France","Atawël, Lou Max, Barée Masse, Pause Jed","house, minimal house, electro house, acid house, deep house",Barée Masse
Concert : Sex shop Mushrooms,2024-01-19,21:00 à 23:00,Seguin Sound,Gratuit,https://shotgun.live/events/concert-sex-shop-mushrooms,"1, Parvis de l'Île Seguin, 92100, Île Seguin, 92100 Boulogne-Billancourt, France",SEX SHOP MUSHROOMS,rock,SEGUIN SOUND
Soirée Nakamako,2024-01-19,20:00 à 01:30,Le Hasard Ludique,"11,89 €",https://shotgun.live/events/soiree-nakamako,"128 Av. de Saint-Ouen, 75018 Paris, France","Imani Griffon, Hyas, String Platine, Kaba CDF","pop, indie rock, uk garage, disco, rap, disco house",Le Hasard Ludique
"TEMET Night w Sha Ru Live,Solid Blake,Florentino & Simo Cell",2024-01-19,23:59 à 06:00,Le Trabendo,"13,00 €",https://shotgun.live/events/temet-night-w-sha-ru-live-solid-blake-florentino-simo-cell,"Parc de, Parc de la Villette, 211 Av. Jean Jaurès, 75019 Paris, France",Simo Cell,"bass, electro",Le Trabendo
Fuego : Grand Bal Zouk,2024-01-19,19:30 à 00:30,La Cité Fertile,Gratuit,https://shotgun.live/events/fuego-grand-bal-zouk,"14 Av. Edouard Vaillant, 93500 Pantin, France",Sonya Hibiscus,afrobeat,La Cité Fertile
La Pépinière • D'amour et d'eau fraîche,2024-01-19,19:30 à 04:00,Le Mazette,"10,99 €",https://shotgun.live/events/la-pepiniere-d-amour-et-d-eau-fraiche,"69 Port de la Rapée, 75012 Paris, France","Jeff The Fool, Malouane, Loryn, Claquettes Chaussettes, Oward, Basic 96","house, minimal house, psytrance, techno",Le Mazette
Where is My Mind? / Nuit Rock 90s,2024-01-20,23:00,Supersonic,"6,50 €",https://dice.fm/event/687m8-where-is-my-mind-nuit-rock-90s-20th-jan-supersonic-paris-tickets,"9 Rue Biscornet, 75012 Paris, France",Live Tribute,,
Vieux Briscards Sound System,2024-01-20,22:00,211,12 €,https://dice.fm/event/5pymy-vieux-briscards-sound-system-20th-jan-211-paris-tickets,"211 Av. Jean Jaurès, 75019 Paris, France","Solo, DJ Crazy B",,
Boum De Flipper • Patates Braves 5 Ans !,2024-01-20,22:00,Le Mazette,"À partir de 9,18 €",https://dice.fm/event/e8npo-boum-de-flipper-patates-braves-5-ans-20th-jan-le-mazette-paris-tickets,"69 Port de la Rapée, 75012 Paris, France",,,
Nastyjoe + Purrs + Difference,2024-01-20,19:00,Supersonic,Gratuit,https://dice.fm/event/xy96e-nastyjoe-purrs-difference-20th-jan-supersonic-paris-tickets,"9 Rue Biscornet, 75012 Paris, France","Difference, PURRS, Nastyjoe",,
Decadance x DOCK B,2024-01-20,14:00,DOCK B,12 €,https://dice.fm/event/n5oa5-decadance-x-dock-b-20th-jan-dock-b-paris-tickets,"1 Place de la Pointe, 93500 Pantin, France",,,
Afrikashine House party,2024-01-20,22:00,Le Perchoir,10 €,https://dice.fm/event/expd2-afrikashine-house-party-20th-jan-le-perchoir-paris-tickets,"14 Rue Crespin Du Gast, 75011 Paris, France",fermeture des portes,,
Poil O'Brass Band,2024-01-20,19:00,Péniche Marcounet,Gratuit,https://dice.fm/event/ar7v2-poil-obrass-band-20th-jan-pniche-marcounet-paris-tickets,"Port de l'Hotel de Ville, Paris 75004",,,
Vieux Briscards Sound System,2024-01-20,22:00,211,12 €,https://dice.fm/event/5pymy-vieux-briscards-sound-system-20th-jan-211-paris-tickets,"211 Av. Jean Jaurès, 75019 Paris, France","Solo, DJ Crazy B",,
"After O'Clock : BFVR B2B ALYS LF, Shekon & Kmyle",2024-01-20,06:00 à 16:00,Glazart,"9,50 €",https://shotgun.live/events/after-o-clock-bfvr-b-2-b-alys-lf-shekon-kmyle,"7 Av. de la Prte de la Villette, 75019 Paris, France","Glazart, BFVR, Alys LF, Shekon, Kmyle",techno,GLAZART
Hippoh Dance Club,2024-01-20,19:00,La Place,10 €,https://dice.fm/event/8qng2-hippoh-dance-club-20th-jan-la-place-paris-tickets,"10 Passage de la Canopée, 75001 Paris, France",,,
We Are The 90's,2024-01-20,23:30,La Machine du Moulin Rouge,"21,32 €",https://dice.fm/event/lk2ar-we-are-the-90s-20th-jan-la-machine-du-moulin-rouge-paris-tickets,"90 Boulevard de Clichy, 75018 Paris, France",Fermeture des portes,,
T7 : STEPHAN BODZIN,2024-01-20,23:00 à 06:00,T7,"19,00 €",https://shotgun.live/events/t-7-stephan-bodzin,"Pl. des Insurgés de Varsovie, 75015 Paris, France","stephanbodzin, Nicolas Masseyeff","melodic house & techno, deep techno, techno",T7
"Dystopia warehouse • EARGASM GOD, DJ Traytex, Panteros666...",2024-01-20,23:00 à 08:00,Non mentionné,"22,05 €",https://shotgun.live/events/dystopia-warehouse-eargasm-god-dj-traytex-panteros-666,Lieu secret,"EARGASM GOD, 𝒟𝒥 𝒯𝓇𝒶𝓎𝓉𝑒𝓍, Panteros666, Die Klar, LEGIT GIRL DJ, RAW","techno, trance",RAW
Hippoh Dance Club,2024-01-20,19:00,La Place,10 €,https://dice.fm/event/8qng2-hippoh-dance-club-20th-jan-la-place-paris-tickets,"10 Passage de la Canopée, 75001 Paris, France",,,
La Dancing,2024-01-20,23:55,Les Étoiles,"À partir de 12,99 €",https://dice.fm/event/brywx-la-dancing-20th-jan-les-toiles-paris-tickets,"61 Rue du Château d'Eau, 75010 Paris, France",,,
We Are The 90's,2024-01-20,23:30,La Machine du Moulin Rouge,"21,32 €",https://dice.fm/event/lk2ar-we-are-the-90s-20th-jan-la-machine-du-moulin-rouge-paris-tickets,"90 Boulevard de Clichy, 75018 Paris, France",Fermeture des portes,,
Where is My Mind? / Nuit Rock 90s,2024-01-20,23:00,Supersonic,"6,50 €",https://dice.fm/event/687m8-where-is-my-mind-nuit-rock-90s-20th-jan-supersonic-paris-tickets,"9 Rue Biscornet, 75012 Paris, France",Live Tribute,,
African Dreams !,2024-01-20,20:00,911 Paris,À partir de Gratuit,https://dice.fm/event/n5wb5-african-dreams-20th-jan-911-paris-paris-tickets,"18 Rue Paul Klee, 75013 Paris, France",,,
Afrikashine House party,2024-01-20,22:00,Le Perchoir,10 €,https://dice.fm/event/expd2-afrikashine-house-party-20th-jan-le-perchoir-paris-tickets,"14 Rue Crespin Du Gast, 75011 Paris, France",fermeture des portes,,
Boum De Flipper • Patates Braves 5 Ans !,2024-01-20,22:00,Le Mazette,"À partir de 9,18 €",https://dice.fm/event/e8npo-boum-de-flipper-patates-braves-5-ans-20th-jan-le-mazette-paris-tickets,"69 Port de la Rapée, 75012 Paris, France",,,
African Dreams !,2024-01-20,20:00,911 Paris,À partir de Gratuit,https://dice.fm/event/n5wb5-african-dreams-20th-jan-911-paris-paris-tickets,"18 Rue Paul Klee, 75013 Paris, France",,,
La Dancing # Samedi 20 Jan,2024-01-20,23:55 à 06:00,Les Étoiles,"12,99 €",https://shotgun.live/events/la-dancing-samedi-20-jan,"61 Rue du Château d'Eau, 75010 Paris, France","David Stepanoff, Marc  Ryan, Sam Karlson","electro, hip hop, r&b, pop, dance, house",Etoiles
La Dancing,2024-01-20,23:55,Les Étoiles,"À partir de 12,99 €",https://dice.fm/event/brywx-la-dancing-20th-jan-les-toiles-paris-tickets,"61 Rue du Château d'Eau, 75010 Paris, France",,,
LA + GROSSE SOIREE HIP HOP DE FRANCE START GAME EPISODE 14,2024-01-20,23:30 à 05:00,Bridge Club,"10,99 €",https://shotgun.live/events/la-grosse-soiree-hip-hop-de-france-start-game-episode-14,"3 Port des Champs-Élysées, 75008 Paris, France",,,BK PRODUCTIONS
Bass Culture: Janeret & D’julz,2024-01-20,23:59 à 07:00,Rex Club,"15,80 €",https://shotgun.live/events/bass-culture-janeret-d-julz,"5 Bd Poissonnière, 75002 Paris, France","Janeret, bassculture, D'Julz","electro, electro house, house, deep house",REX CLUB
ACCIDENT THEORY PARTY SERIES : LAURENT GARNIER // AXEL BLANC,2024-01-20,23:59 à 06:00,Cabaret Sauvage,,https://shotgun.live/events/accident-theory-party-series-laurent-garnier-axel-blanc,"59 Bd Macdonald, 75019 Paris, France","AXEL BLANC, laurent garnier",,CABARET SAUVAGE
"STUDIO Invites Ivy Lab, Skeptical, Subp Yao, & More!",2024-01-20,23:59 à 06:00,Petit Bain,"22,98 €",https://shotgun.live/events/studio-invites-ivy-lab-skeptical-subp-yao-more,"7 Port de la Gare, 75013 Paris, France","Ivy Lab, Skeptical, Subp Yao, Ana Bleue, Aastal","bass, drum & bass, dubstep, electronica, breakbeat, ebm",STUDIO
"J'peux pas, J'ai Péniche... 20/01/2024",2024-01-20,20:00 à 05:00,River's King,"10,99 €",https://shotgun.live/events/j-peux-pas-j-ai-peniche-20-01-2024,"4 Quai Saint-Bernard, 75005 Paris, France",,"disco, house, pop rock, club, hip hop, disco house","J'peux pas, J'ai Péniche"
NEXUS : NYCTONIAN | LA PENDERIE NOIRE | ANSBRO & More,2024-01-20,23:00 à 07:00,Nexus,"11,99 €",https://shotgun.live/events/nexus-nyctonian-la-penderie-noire-ansbro-more,"100 Av. du Général Leclerc, 93500 Pantin, France","Nyctonian, La Penderie Noire, ANSBRO","acid techno, electro, hard techno, german techno, industrial techno, hard trance",Nexus
Boum De Flipper • Patates Braves 5 Ans,2024-01-20,22:00 à 06:00,Le Mazette,"8,99 €",https://shotgun.live/events/boom-de-flipper-patates-braves-5-ans,"69 Port de la Rapée, 75012 Paris, France","Fausse Sceptique, Vitaline, Les Patates Braves","electro, house, techno",Le Mazette
Dalton John + Kheli + Sainte Exp (Club),2024-01-20,23:45,L'international,"7,50 €",https://dice.fm/event/do8vv-dalton-john-kheli-sainte-exp-club-20th-jan-linternational-paris-tickets,"5 Rue Moret, 75011 Paris, France",,,
LUST - CHAPITRE III,2024-01-20,23:00,FVTVR,12 €,https://dice.fm/event/o7v6r-lust-chapitre-iii-20th-jan-fvtvr-paris-tickets,"34 Quai d'Austerlitz, 75013 Paris, France",Fermeture des portes,,
Club Society I Club Roquette,2024-01-20,22:00,Le Food Society Paris,Gratuit,https://dice.fm/event/arekv-club-society-i-club-roquette-20th-jan-le-food-society-paris-paris-tickets,"68 Avenue Du Maine, 75014 Paris, France","Dj set, Fin de la soirée",,
Vinyle Village ☽ One Night Stand,2024-01-20,22:00,La Rotonde,"À partir de 9,92 €",https://dice.fm/event/arppq-vinyle-village-one-night-stand-20th-jan-la-rotonde-paris-tickets,"6 Place de la Bataille de Stalingrad, 75019 Paris, France",,,
Gate 9 & K-Pich invitent Loa Szala @LaJava,2024-01-20,23:30,La Java,À partir de 13 €,https://dice.fm/event/pnpdk-gate-9-k-pich-invitent-loa-szala-lajava-20th-jan-la-java-paris-tickets,"105 Rue du Faubourg du Temple, 75010 Paris, France",Loa Szala,,
Reggaeton party sur les toits de paris,2024-01-20,23:00,Tout Le Monde en Parle,À partir de Gratuit,https://dice.fm/event/5p8w8-reggaeton-party-sur-les-toits-de-paris-20th-jan-tout-le-monde-en-parle-paris-tickets,"4 Rue Du Départ, 75015 Paris, France","Fermeture des portes, djalkior",,
Gate 9 & K-Pich invitent Loa Szala @LaJava,2024-01-20,23:30 à 07:00,La Java,"10,69 €",https://shotgun.live/events/gate-9-k-pich-invitent-loa-szala-la-java,"105 Rue du Faubourg du Temple, 75010 Paris, France","Loa Szala, GATE 9, Saul, RUBEN, K-PICH, Asaya, Averse, T.HERR","electro, house, minimal house, micro house",LA JAVA
BOOM avec DJ MAÏ TAÏ,2024-01-20,21:00,Péniche Marcounet,Gratuit,https://dice.fm/event/8qxrw-boom-avec-dj-ma-ta-20th-jan-pniche-marcounet-paris-tickets,"Port de l'Hotel de Ville, Paris 75004",,,
Malo,2024-01-20,20:30,EMB Sannois,"15,41 €",https://dice.fm/event/xo66l-malo-20th-jan-emb-sannois-paris-tickets,"2 Rue du Président Georges Pompidou, 95110 Sannois, France",,,
ZAOUI,2024-01-20,20:00,Le Plan,"16,83 €",https://dice.fm/event/bo3ro-zaoui-20th-jan-le-plan-paris-tickets,"1 Avenue Louis Aragon, 91130 Ris-Orangis, France","Zaoui, Liv Del Estal",,
Corine + Martine Patine : La Grande Folie,2024-01-20,20:00,Théâtre Jean-Vilar,"À partir de 9,18 €",https://dice.fm/event/oabog-corine-martine-patine-la-grande-folie-20th-jan-thtre-jean-vilar-vitry-sur-seine-tickets,"1 Place Jean Vilar, 94400 Vitry-sur-Seine, France","Première partie, Corine, Martine Patine",,
Concert : Rock Eclair,2024-01-20,21:00 à 23:00,Seguin Sound,,https://shotgun.live/events/concert-rock-eclair,"1, Parvis de l'Île Seguin, 92100, Île Seguin, 92100 Boulogne-Billancourt, France",,"rock, pop rock, indie rock",SEGUIN SOUND
PMU WAREHOUSE,2024-01-20,23:59 à 07:00,Non mentionné,"14,99 €",https://shotgun.live/events/pmu-warehouse,Lieu secret,,"house, minimal house, progressive house, disco house, acid house",PMU
La Grande folie - Corine - EIGHTY - Martine Patine,2024-01-20,20:00 à 01:00,Théâtre Jean-Vilar,"8,99 €",https://shotgun.live/events/la-grande-folie-corine-eighty-martine-patine,"1 place Jean Vilar, Av. de l'Abbé Roger Derry, 94400 Vitry-sur-Seine, France",,disco,Théâtre Jean Vilar
La Boum - Paris,2024-01-20,18:30 à 02:00,Nodd Oxygen,"7,00 €",https://shotgun.live/events/la-boum-paris,"2 Espl. du Général de Gaulle, 92800 Courbevoie, France",,,ENJOY
Flash Cocotte 20/01,2024-01-20,23:59 à 06:00,Le Trabendo,"16,00 €",https://shotgun.live/events/flash-cocotte-20-01,"Parc de, Parc de la Villette, 211 Av. Jean Jaurès, 75019 Paris, France","Pipi De Frèche, DJ Europarking, Flash Cocotte","techno, electro, house",Le Trabendo
Sacré présente Mira Ló / State Of Mind #3,2024-01-20,23:00 à 06:00,Sacré,"10,00 €",https://shotgun.live/events/sacre-presente-mira-lo-state-of-mind-3,"142 Rue Montmartre, 75002 Paris, France","Mira Ló, DJ Suspect","house, acid house, deep house, funk, disco",Sacré
"QUEST404 Day Sessions : Mama Snake, Adam Pits, Aloka, sa+ga",2024-01-20,15:00 à 00:30,La Cité Fertile,"15,99 €",https://shotgun.live/events/quest-404-day-sessions-mama-snake-adam-pits-aloka-sa-ga,"14 Av. Edouard Vaillant, 93500 Pantin, France","Mama Snake, Adam Pits, Aloka, sa+ga","trance, techno, electro",Quest404
Decadance x DOCK B,2024-01-20,14:00,DOCK B,12 €,https://dice.fm/event/n5oa5-decadance-x-dock-b-20th-jan-dock-b-paris-tickets,"1 Place de la Pointe, 93500 Pantin, France",,,
Chrysalide #3,2024-01-20,20:00 à 23:59,Le Hasard Ludique,"10,89 €",https://shotgun.live/events/chrysalide-3,"128 Av. de Saint-Ouen, 75018 Paris, France","Suzy_Phosphore, 🄺🄴🄻🅈🄱🄾🅈, Couedasse","eurodance, electro, pop, rap, hip hop, r&b",Le Hasard Ludique
Poil O'Brass Band,2024-01-20,19:00,Péniche Marcounet,Gratuit,https://dice.fm/event/ar7v2-poil-obrass-band-20th-jan-pniche-marcounet-paris-tickets,"Port de l'Hotel de Ville, Paris 75004",,,
SIZ + Trainfantome + Shoefiti,2024-01-20,19:00,L'international,8 €,https://dice.fm/event/372yx-siz-trainfantome-shoefiti-20th-jan-linternational-paris-tickets,"5 Rue Moret, 75011 Paris, France",,,
Dalì,2024-01-20,19:30,La Boule Noire,18 €,https://dice.fm/event/m9g3v-dal-20th-jan-la-boule-noire-paris-tickets,"120 Boulevard de Rochechouart, 75018 Paris, France",https://open.spotify.com/intl-fr/artist/02gko1zWBeKdi4oXeV8qfo,,
"VIRAGES x LA JAVA : Regularboy, Hiver 17 & More",2024-01-20,20:00,La Java,5 €,https://dice.fm/event/mg38k-virages-x-la-java-regularboy-hiver-17-more-20th-jan-la-java-paris-tickets,"105 Rue du Faubourg du Temple, 75010 Paris, France",,,
Nastyjoe + Purrs + Difference,2024-01-20,19:00,Supersonic,Gratuit,https://dice.fm/event/xy96e-nastyjoe-purrs-difference-20th-jan-supersonic-paris-tickets,"9 Rue Biscornet, 75012 Paris, France","Difference, PURRS, Nastyjoe",,
Les Dimanchanteurs,2024-01-21,19:00,Péniche Marcounet,12 €,https://dice.fm/event/g3lv2-les-dimanchanteurs-21st-jan-pniche-marcounet-paris-tickets,"Port de l'Hotel de Ville, Paris 75004","Adélys, Margot Madani",,
Jimmy Brown & Rovv : Like The First Time Tour,2024-01-21,18:00,La Place,"À partir de 33,70 €",https://dice.fm/event/5lodw-jimmy-brown-rovv-like-the-first-time-tour-21st-jan-la-place-paris-tickets,"10 Passage de la Canopée, 75001 Paris, France","Jimmy Brown, Rovv",,
Brunch : Les Douces Cordes,2024-01-21,12:00,Péniche Marcounet,Gratuit,https://dice.fm/event/doqbv-brunch-les-douces-cordes-21st-jan-pniche-marcounet-paris-tickets,"Port de l'Hotel de Ville, Paris 75004","Romain Brizemur, Caroline Cartier",,
Sunday Tribute - Elton John,2024-01-21,19:00,Supersonic,Gratuit,https://dice.fm/event/567nl-sunday-tribute-elton-john-21st-jan-supersonic-paris-tickets,"9 Rue Biscornet, 75012 Paris, France",,,
Nep & Friends,2024-01-21,20:30,La Boule Noire,"21,15 €",https://dice.fm/event/qpoky-nep-friends-21st-jan-la-boule-noire-paris-tickets,"120 Boulevard de Rochechouart, 75018 Paris, France",,,
Neighbor Hood Soundsystem 10 years AFTERPARTY // CAFE BARGE,2024-01-21,04:00 à 15:00,Café Barge Restaurant,"15,99 €",https://shotgun.live/events/neighbor-hood-soundsystem-10-years-afterparty-cafe-barge,"Port de la Rapée, 75012 Paris, France","Oward, V!KTOR, Alex NH","minimal house, electro, breakbeat",NEIGHBOR HOOD
"After O'Clock : Toscan Haas, John Dixon & Fred B Side",2024-01-21,06:00 à 16:00,Glazart,"9,50 €",https://shotgun.live/events/after-o-clock-toscan-haas-john-dixon-fred-b-side,"7 Av. de la Prte de la Villette, 75019 Paris, France","Toscan Haas, JOHN DIXON, fred b side, Glazart",techno,GLAZART
GOGO GREEN 21/01/24,2024-01-21,23:59 à 06:00,La Gare / Le Gore,"5,99 €",https://shotgun.live/events/gare-aux-soeurs-malsaines-25-12-23,"1 Av. Corentin Cariou, 75019 Paris, France",,,LeGore
Comic Out #3,2024-01-22,20:00 à 22:00,Jamel Comedy Club,"26,25 €",https://shotgun.live/events/comic-out-3,"42 Bd de Bonne Nouvelle, 75010 Paris, France",,pop,Gaypopevent
BADA-BADA,2024-01-22,20:00,POPUP!,"14,50 €",https://dice.fm/event/3xrkx-bada-bada-22nd-jan-popup-paris-tickets,"14 Rue Abel, 75012 Paris, France",Bada-Bada,,
Geeeko,2024-01-22,19:30,La Boule Noire,"15,50 €",https://dice.fm/event/pblmy-geeeko-22nd-jan-la-boule-noire-paris-tickets,"120 Boulevard de Rochechouart, 75018 Paris, France",Geeeko,,
Madzo & Friends,2024-01-22,19:30,L'international,"11,50 €",https://dice.fm/event/3xxlp-madzo-friends-22nd-jan-linternational-paris-tickets,"5 Rue Moret, 75011 Paris, France",Madzo,,
La Rosa + Damaghead + Taxon Lazar,2024-01-22,19:00,Supersonic,Gratuit,https://dice.fm/event/37g2p-la-rosa-damaghead-taxon-lazar-22nd-jan-supersonic-paris-tickets,"9 Rue Biscornet, 75012 Paris, France","Taxon Lazar, Damaghead, La Rosa",,
Dorian Electra presents Fanfare — World Tour,2024-01-22,19:00,La Cigale,"31,42 €",https://dice.fm/event/kd238-dorian-electra-presents-fanfare-world-tour-22nd-jan-la-cigale-paris-tickets,"120 Boulevard de Rochechouart, 75018 Paris, France",Dorian Electra,,
Des Rocs,2024-01-22,20:00,Trabendo,22 €,https://dice.fm/event/ywpmr-des-rocs-22nd-jan-trabendo-paris-tickets,"Parc de la Villette, 211 Avenue Jean Jaurès, 75019 Paris",Des Rocs,,
Prince Waly,2024-01-23,20:00,L'Olympia,"À partir de 38,50 €",https://dice.fm/event/xngge-prince-waly-23rd-jan-lolympia-paris-tickets,"28 Boulevard des Capucines, 75009 Paris, France",Prince Waly,,
Manolo Redondo + Cymbaline + Suzy 2,2024-01-23,19:00,L'international,8 €,https://dice.fm/event/exlb6-manolo-redondo-cymbaline-suzy-2-23rd-jan-linternational-paris-tickets,"5 Rue Moret, 75011 Paris, France","Manolo Redondo, Cymbaline, Suzy 2",,
Chrones + Soft Michel + Wakan Tanka,2024-01-23,19:00,Supersonic,Gratuit,https://dice.fm/event/68mgq-chrones-soft-michel-wakan-tanka-23rd-jan-supersonic-paris-tickets,"9 Rue Biscornet, 75012 Paris, France","Wakan Tanka, Soft Michel, Chrones",,
James Baker,2024-01-23,20:00,La Boule Noire,20 €,https://dice.fm/event/9598d-james-baker-23rd-jan-la-boule-noire-paris-tickets,"120 Boulevard de Rochechouart, 75018 Paris, France","1ère partie, James Baker",,
Children Of The Pope + Seesters,2024-01-24,19:00,Supersonic,Gratuit,https://dice.fm/event/qpmdp-children-of-the-pope-seesters-24th-jan-supersonic-paris-tickets,"9 Rue Biscornet, 75012 Paris, France","Seesters, Children Of The Pope",,
Jose Gonzalez - A Tiger in Paradise,2024-01-24,19:00,Alhambra,"40,40 €",https://dice.fm/event/nd7wl-jose-gonzalez-a-tiger-in-paradise-24th-jan-alhambra-paris-tickets,"21 Rue Yves Toudic, 75010 Paris, France","Projection film, Questions et réponses + concert",,
Jose Gonzalez - A Tiger in Paradise,2024-01-24,19:00,Alhambra,"40,40 €",https://dice.fm/event/nd7wl-jose-gonzalez-a-tiger-in-paradise-24th-jan-alhambra-paris-tickets,"21 Rue Yves Toudic, 75010 Paris, France","Projection film, Questions et réponses + concert",,
Children Of The Pope + Seesters,2024-01-24,19:00,Supersonic,Gratuit,https://dice.fm/event/qpmdp-children-of-the-pope-seesters-24th-jan-supersonic-paris-tickets,"9 Rue Biscornet, 75012 Paris, France","Seesters, Children Of The Pope",,
La Extravaganza : cabaret,2024-01-24,20:00 à 23:30,Le Hasard Ludique,"13,39 €",https://shotgun.live/events/la-extravaganza-cabaret,"128 Av. de Saint-Ouen, 75018 Paris, France",,,Le Hasard Ludique
Live  • Scuffles + Lollie Dextrose,2024-01-24,19:30,Le Mazette,10 €,https://dice.fm/event/wp98g-live-scuffles-lollie-dextrose-24th-jan-le-mazette-paris-tickets,"69 Port de la Rapée, 75012 Paris, France","Première partie, Scuffles",,
Jose Gonzalez - A Tiger in Paradise,2024-01-24,19:00,Alhambra,"40,40 €",https://dice.fm/event/nd7wl-jose-gonzalez-a-tiger-in-paradise-24th-jan-alhambra-paris-tickets,"21 Rue Yves Toudic, 75010 Paris, France","Projection film, Questions et réponses + concert",,
Children Of The Pope + Seesters,2024-01-24,19:00,Supersonic,Gratuit,https://dice.fm/event/qpmdp-children-of-the-pope-seesters-24th-jan-supersonic-paris-tickets,"9 Rue Biscornet, 75012 Paris, France","Seesters, Children Of The Pope",,
